<?xml version='1.0' encoding='UTF-8'?>
<players xmlns:xsi="http://www.w3.org/2001/XMLSchema-instance" xsi:noNamespaceSchemaLocation="../../schemas/players.xsd">
	<player id='Empire' race='human' name='players.empire'
		icon='starmap/fleets/human_fleet'
		color='FFFCB000'
		picture='database/freenations'
		user='true'
		money='32000'
		initial-stance='50'
		ai='NONE'
		colonization-limit='-1'
		diplomacy-head='diplomacy/dipfej7'
	>
	<!-- Initial inventory.
	 -->
	 <!-- Actually, this should be the reward for Mission 3. 
		<inventory id='Shield1' count='1'/>
	 -->
	<!-- Available technology override.
		<available>
			<type id='' list=''/>
		</available>
	-->
	<!-- Initial fleets. -->
		<fleet id='0' x='330' y='440' name='@MainFleet'>
			<item id='-1' type='Destroyer1' count='1' tag='CampaignMainShip1'>
				<slot id='laser' type='Laser1' count='3'/>
				<slot id='hyperdrive' type='HyperDrive1' count='1'/>
			</item>
			<item id='-1' type='Fighter1' count='3' />
		</fleet>
		<nicknames>
			<nickname>Berserker</nickname>
			<nickname>Executor</nickname>
			<nickname>Chaotic</nickname>
			<nickname>Excalibur</nickname>
			<nickname>Ivan</nickname>
			<nickname>Crusher</nickname>
			<nickname>Metdown</nickname>
			<nickname>Hunter</nickname>
			<nickname>Falcon</nickname>
			<nickname>Eagle</nickname>
			<nickname>Terminator</nickname>
			<nickname>Tiger</nickname>
			<nickname>Puma</nickname>
			<nickname>Giant</nickname>
			<nickname>The Hammer</nickname>
			<nickname>Dracula</nickname>
			<nickname>Nightmare</nickname>
			<nickname>The Anvil</nickname>
			<nickname>Red Star</nickname>
			<nickname>Lightning</nickname>
			<nickname>Lion</nickname>
			<nickname>Wildcat</nickname>
			<nickname>Bat</nickname>
			<nickname>Shark</nickname>
			<nickname>Condor</nickname>
			<nickname>Neptune</nickname>
			<nickname>Ares</nickname>
			<nickname>Minerva</nickname>
			<nickname>Odin</nickname>
			<nickname>Black Knight</nickname>
			<nickname>Sword</nickname>
			<nickname>Chronos</nickname>
			<nickname>Dingo</nickname>
			<nickname>Lynx</nickname>
			<nickname>Azor</nickname>
			<nickname>Peregrin</nickname>
			<nickname>Grizzlie</nickname>
			<nickname>Orca</nickname>
			<nickname>Phoenix</nickname>
			<nickname>Dolphin</nickname>
			<nickname>Guepard</nickname>
			<nickname>Ocean</nickname>
			<nickname>Raider</nickname>
			<nickname>Green Dragon</nickname>
		</nicknames>
	</player>
	<player id='Garthog' race='garthog' name='players.garthog'
		icon='starmap/fleets/garthog_fleet'
		color='FFFC2828'
		picture='database/garthog'
		money='32000'
		initial-stance='40'
		ai='DEFAULT' ratios='1,2,1'
		exploration-inner-limit=''
		exploration-outer-limit=''
		colonization-limit='0'
		war-threshold='98'
		diplomacy-head='diplomacy/dipfej9'
		police-ratio='15'
	>
		<available>
			<type id='PhoodFactory' list=''/>
			<type id='MediumTank' list=''/>
			<type id='RocketLauncher1' list=''/>
			<type id='OrbitalFactory' list=''/>
			<type id='SpySatellite1' list=''/>
			<type id='HyperDrive3' list=''/>
			<type id='Laser2' list=''/>
			<type id='IonCannon' list=''/>
			<type id='TradeCenter' list=''/>
			<type id='Fortress' list=''/>
			<type id='GarthogRadarJammer' list=''/>
		</available>
	</player>
	<player id='Morgath' race='morgath' name='players.morgath'
		icon='starmap/fleets/morgath_fleet'
		color='FFFCFCFC'
		picture='database/morgath'
		money='32000'
		initial-stance='40'
		colonization-limit='3'
		diplomacy-head='diplomacy/dipfej1'
		police-ratio='15'
		ai='DEFAULT' ratios='1,2,1'
	>
		<inventory id='ColonyShip' count='2'/>
		<available>
			<type id='PhoodFactory' list=''/>
			<type id='ColonyShip' list=''/>
			<type id="MediumTank" list=""/>
			<type id="RocketLauncher1" list=""/>
			<type id='OrbitalFactory' list=''/>
			<type id='TradeCenter' list=''/>
			<type id='Fortress' list=''/>
		</available>
	</player>
	<player id='Ychom' race='ychom' name='players.ychom'
		icon='starmap/fleets/ychom_fleet'
		color='FF00FFFF'
		picture='database/ychom'
		money='32000'
		initial-stance='40'
		colonization-limit='3'
		diplomacy-head='diplomacy/dipfej2'
		police-ratio='15'
		ai='DEFAULT' ratios='1,2,1'
	>
		<available>
			<type id='PhoodFactory' list=''/>
			<type id='MediumTank' list=''/>
			<type id='YchomMinelayer' list=''/>
			<type id='RocketLauncher1' list=''/>
			<type id='ColonyShip' list=''/>
			<type id='OrbitalFactory' list=''/>
			<type id='TradeCenter' list=''/>
			<type id='Fortress' list=''/>
		</available>
	</player>
	<player id='Dribs' race='dribs' name='players.dribs'
		icon='starmap/fleets/dribs_fleet'
		color='FFFC00FC'
		picture='database/drib'
		money='32000'
		initial-stance='40'
		colonization-limit='2'
		diplomacy-head='diplomacy/dipfej3'
		police-ratio='15'
		ai='DEFAULT' ratios='1,2,1'
	>
		<inventory id='ColonyShip' count='1'/>
		<available>
			<type id='PhoodFactory' list=''/>
			<type id='ColonyShip' list=''/>
			<type id='MediumTank' list=''/>
			<type id='DribsParalizer' list=''/>
			<type id='RocketLauncher1' list=''/>
			<type id='OrbitalFactory' list=''/>
			<type id='TradeCenter' list=''/>
			<type id='Fortress' list=''/>
		</available>
	</player>
	<player id='Sullep' race='sullep' name='players.sullep'
		icon='starmap/fleets/sullep_fleet'
		color='FFFCFC58'
		picture='database/sullep'
		money='32000'
		initial-stance='40'
		colonization-limit='0'
		diplomacy-head='diplomacy/dipfej4'
		police-ratio='15'
		ai='DEFAULT' ratios='1,2,1'
	>
		<available>
			<type id='PhoodFactory' list=''/>
			<type id='ColonyShip' list=''/>
			<type id='MediumTank' list=''/>
			<type id='RocketLauncher1' list=''/>
			<type id='OrbitalFactory' list=''/>
			<type id='TradeCenter' list=''/>
			<type id='Fortress' list=''/>
			<type id='SullepArtillery' list=''/>
		</available>
	</player>
	<player id='Dargslan' race='dargslan' name='players.dargslan'
		icon='starmap/fleets/dargslan_fleet'
		color='FF009800'
		picture='database/dargslan'
		money='32000'
		initial-stance='10'
		exploration-inner-limit=''
		exploration-outer-limit=''
		colonization-limit='0'
		diplomacy-head='diplomacy/dipfej5'
		war-threshold='90'
		police-ratio='15'
		ai='DEFAULT' ratios='1,2,1'
	>
		<available>
			<type id='PhoodFactory' list=''/>
			<type id='ColonyShip' list=''/>
			<type id='Bomb2' list=''/>
			<type id='Rocket2' list=''/>
			<type id='MultiheadedRocket' list=''/>
			<type id='MediumTank' list=''/>
			<type id='HeavyTank' list=''/>
			<type id='DargslanSelfRepairTank' list=''/>
			<type id='RocketLauncher2' list=''/>
			<type id='OrbitalFactory' list=''/>
			<type id='TradeCenter' list=''/>
			<type id='Fortress' list=''/>
		</available>
	</player>
	<player id='Ecalep' race='ecalep' name='players.ecalep'
		icon='starmap/fleets/ecalep_fleet'
		color='FFB0FC6C'
		picture='database/ecalep'
		money='32000'
		initial-stance='40'
		colonization-limit='1'
		diplomacy-head='diplomacy/dipfej6'
		police-ratio='15'
		ai='DEFAULT' ratios='1,2,1'
	>
		<inventory id='ColonyShip' count='1'/>
		<available>
			<type id='PhoodFactory' list=''/>
			<type id='MultiheadedRocket' list=''/>
			<type id='ColonyShip' list=''/>
			<type id="HeavyTank" list=""/>
			<type id="EcalepRocketJammer" list=""/>
			<type id="RocketLauncher1" list=""/>
			<type id='OrbitalFactory' list=''/>
			<type id='TradeCenter' list=''/>
			<type id='Fortress' list=''/>
		</available>
	</player>
	<player id='FreeTraders' race='human' name='players.free_traders'
		icon='starmap/fleets/free_traders_fleet'
		color='FF3C3CFC'
		picture='database/freetraders'
		money='32000'
		initial-stance='50'
		colonization-limit='2'
		diplomacy-head='diplomacy/dipfej7'
		ai='DEFAULT' ratios='1,2,1'
	>
		<inventory id='ColonyShip' count='2'/>
		<available>
			<type id='PhoodFactory' list=''/>
			<type id='ColonyShip' list=''/>
			<type id='MediumTank' list=''/>
			<type id='RocketLauncher1' list=''/>
			<type id='ECM1' list=''/>
			<type id='Cruiser1' list=''/>
			<type id='Fighter2' list=''/>
			<type id='Fighter3' list=''/>
			<type id='Fighter4' list=''/>
			<type id='Shield2' list=''/>
			<type id='Shield3' list=''/>
			<type id='HyperDrive1' list=''/>
			<type id='HyperDrive2' list=''/>
			<type id='HyperDrive3' list=''/>
			<type id='Laser2' list=''/>
			<type id='Laser3' list=''/>
			<type id='OrbitalFactory' list=''/>
			<type id='Fortress' list=''/>
		</available>
	</player>
	<player id='FreeNations' race='human' name='players.free_nations'
		icon='starmap/fleets/free_nations_fleet'
		color='FF94A4FC'
		picture='database/freenations'
		money='32000'
		initial-stance='50'
		colonization-limit='0'
		diplomacy-head='diplomacy/dipfej8'
		ai='DEFAULT' ratios='1,2,1'
	>
		<available>
			<type id='PhoodFactory' list=''/>
			<type id='ColonyShip' list=''/>
			<type id='MediumTank' list=''/>
			<type id='RocketLauncher1' list=''/>
			<type id='ECM1' list=''/>
			<type id='Cruiser1' list=''/>
			<type id='Fighter2' list=''/>
			<type id='Fighter3' list=''/>
			<type id='Fighter4' list=''/>
			<type id='Shield2' list=''/>
			<type id='Shield3' list=''/>
			<type id='HyperDrive1' list=''/>
			<type id='HyperDrive2' list=''/>
			<type id='HyperDrive3' list=''/>
			<type id='Laser2' list=''/>
			<type id='Laser3' list=''/>
			<type id='OrbitalFactory' list=''/>
		</available>
	</player>
	<player id='Pirates' race='pirates' name='players.pirates'
		icon='starmap/fleets/pirates_fleet'
		color='FF95416E'
		picture='database/pirates'
		money='32000'
		initial-stance='10'
		ai='PIRATES'
		nodiplomacy='true'
		colonization-limit='0'
		police-ratio='15'
		noskirmish='true'
	>
		<available>
			<type id='ColonyShip' list=''/>
			<type id='OrbitalFactory' list=''/>